{
  "$schema": "https://json-schema.org/draft/2020-12/schema",
  "$id": "https://raw.githubusercontent.com/Degrudv/caravan-protocol-spec/main/schemas/reputation-attestation.schema.json",
  "title": "ReputationAttestation",
  "description": "EAS attestation on Base (§5.1). minted_by is fixed to SettlementContract: params.identity.reputationMinter = \"SettlementContract-only\".",
  "type": "object",
  "additionalProperties": false,
  "required": ["subject", "schema", "minted_by"],
  "properties": {
    "subject": {
      "type": "string",
      "format": "uuid",
      "description": "principal_id this attestation is about."
    },
    "schema": {
      "type": "string",
      "enum": ["settled_volume", "counterparty_count", "dispute_outcome", "slash_event", "offer_integrity"]
    },
    "minted_by": {
      "type": "string",
      "const": "SettlementContract",
      "description": "Reputation attestations may only be minted by the canonical SettlementContract; no other minter is valid (§5.1, params.identity.reputationMinter)."
    },
    "uid": {
      "type": "string",
      "pattern": "^0x[a-fA-F0-9]{64}$",
      "description": "EAS attestation UID, populated once minted on-chain. Not enumerated in §5.1's 3-field list; included as optional realistic EAS envelope metadata."
    },
    "chain": {
      "type": "string",
      "enum": ["base-sepolia", "base"],
      "description": "Optional. See params.chain."
    },
    "attested_at": {
      "type": "string",
      "format": "date-time"
    },
    "data": {
      "type": "object",
      "description": "Optional schema-specific attestation payload; shape depends on `schema` (deliberately open-ended, unlike every other object in this schema).",
      "additionalProperties": true
    }
  }
}
